{
  "id": "next-zero-now",
  "runnerProtocol": "1",
  "operation": "nextTimestamp",
  "specificationCommit": "abc9a55d90f1026e6509207abda73e5dc6d14241",
  "specificationSections": [
    "Section 5.3"
  ],
  "derivationStatus": "specification",
  "faultProfile": "none",
  "expected": {
    "outcome": "accepted"
  },
  "input": {
    "nowMs": "0",
    "previousTimestampMs": null
  },
  "expectedResult": {
    "timestampMs": "0",
    "error": null
  }
}
