{
  "id": "author-b5-root-revoked",
  "runnerProtocol": "1",
  "operation": "authorRecord",
  "specificationCommit": "abc9a55d90f1026e6509207abda73e5dc6d14241",
  "specificationSections": [
    "Appendix B.5"
  ],
  "derivationStatus": "specification",
  "faultProfile": "none",
  "expected": {
    "outcome": "accepted"
  },
  "input": {
    "rootSeedHex": "000102030405060708090a0b0c0d0e0f101112131415161718191a1b1c1d1e1f",
    "revocationSeedHex": "202122232425262728292a2b2c2d2e2f303132333435363738393a3b3c3d3e3f",
    "authority": "rootRevoked",
    "timestampMs": "1785589201123",
    "validUntilMs": null,
    "contact": {
      "displayName": "Alice Example",
      "summary": "Writer",
      "avatar": null,
      "alsoKnownAs": [
        "acct:alice@example.com"
      ],
      "services": [
        {
          "id": "feed",
          "type": "Feed",
          "endpoint": "https://alice.example/feed.xml",
          "mediaType": "application/atom+xml",
          "label": "Writing",
          "language": null,
          "rel": null
        }
      ],
      "migration": null,
      "extensions": {}
    },
    "extensions": {},
    "signingSeed": "revocation"
  },
  "expectedResult": {
    "did": "did:flw:zQmPcGstBa7wW9hoYQbS6JZ4UxwZmoKr7YVf9y7qxiyD3Cm",
    "recordBodyCborHex": "a700010178376469643a666c773a7a516d5063477374426137775739686f59516253364a5a345578775a6d6f4b7237595666397937717869794433436d021b0000019fbd68f8e3030104a3000101a2003201582003a107bff3ce10be1d70dd18e74bc09967e4d6309ba50d5f1ddc8664125531b8025820d123bafb7ae35472d9a73944d98314a38ff8f201d79c32e640f97a27bec880de05a2003201582029acbae141bccaf0b22e1a94d34d0bc7361e526d0bfe12c89794bc9322966dd707a4006d416c696365204578616d706c650166577269746572038176616363743a616c696365406578616d706c652e636f6d0481a500646665656401644665656402781e68747470733a2f2f616c6963652e6578616d706c652f666565642e786d6c03746170706c69636174696f6e2f61746f6d2b786d6c046757726974696e67",
    "recordBodyDigestHex": "3c617919801d0c19684144f9b46e0f2384243c17c831a2d76531ba6554cb3861",
    "signatureHex": "c874ee1bb01dc4f3972b978455abba78ab0f84755fbd9ee01425a1e6c910abae7cfa8b407aff2092be09e9032e968a23a87e63f9e1e7b2a0d5498bf7df5d6c09",
    "envelopeHex": "d28443a10132a059013fa700010178376469643a666c773a7a516d5063477374426137775739686f59516253364a5a345578775a6d6f4b7237595666397937717869794433436d021b0000019fbd68f8e3030104a3000101a2003201582003a107bff3ce10be1d70dd18e74bc09967e4d6309ba50d5f1ddc8664125531b8025820d123bafb7ae35472d9a73944d98314a38ff8f201d79c32e640f97a27bec880de05a2003201582029acbae141bccaf0b22e1a94d34d0bc7361e526d0bfe12c89794bc9322966dd707a4006d416c696365204578616d706c650166577269746572038176616363743a616c696365406578616d706c652e636f6d0481a500646665656401644665656402781e68747470733a2f2f616c6963652e6578616d706c652f666565642e786d6c03746170706c69636174696f6e2f61746f6d2b786d6c046757726974696e675840c874ee1bb01dc4f3972b978455abba78ab0f84755fbd9ee01425a1e6c910abae7cfa8b407aff2092be09e9032e968a23a87e63f9e1e7b2a0d5498bf7df5d6c09"
  }
}
