{
  "id": "author-contact-empty",
  "runnerProtocol": "1",
  "operation": "authorRecord",
  "specificationCommit": "abc9a55d90f1026e6509207abda73e5dc6d14241",
  "specificationSections": [
    "Section 7.1"
  ],
  "derivationStatus": "specification",
  "faultProfile": "none",
  "expected": {
    "outcome": "accepted"
  },
  "input": {
    "rootSeedHex": "000102030405060708090a0b0c0d0e0f101112131415161718191a1b1c1d1e1f",
    "revocationSeedHex": "202122232425262728292a2b2c2d2e2f303132333435363738393a3b3c3d3e3f",
    "authority": "root",
    "timestampMs": "1785589200123",
    "validUntilMs": null,
    "contact": {
      "displayName": null,
      "summary": null,
      "avatar": null,
      "alsoKnownAs": [],
      "services": [],
      "migration": null,
      "extensions": {}
    },
    "extensions": {},
    "signingSeed": "root"
  }
}
