{
  "id": "strict-key-noncanonical",
  "runnerProtocol": "1",
  "operation": "strictEd25519",
  "specificationCommit": "abc9a55d90f1026e6509207abda73e5dc6d14241",
  "specificationSections": [
    "Section 3.3 rule 3"
  ],
  "derivationStatus": "specification",
  "faultProfile": "single",
  "expected": {
    "outcome": "accepted"
  },
  "input": {
    "publicKeyHex": "ffffffffffffffffffffffffffffffffffffffffffffffffffffffffffffffff",
    "messageHex": "846a5369676e61747572653143a10132581a466f6c6c6f7765652f4964656e746974795265636f72642f7631590118a600010178376469643a666c773a7a516d5063477374426137775739686f59516253364a5a345578775a6d6f4b7237595666397937717869794433436d021b0000019fbd68f4fb030004a3000101a2003201582003a107bff3ce10be1d70dd18e74bc09967e4d6309ba50d5f1ddc8664125531b8025820d123bafb7ae35472d9a73944d98314a38ff8f201d79c32e640f97a27bec880de07a4006d416c696365204578616d706c650166577269746572038176616363743a616c696365406578616d706c652e636f6d0481a500646665656401644665656402781e68747470733a2f2f616c6963652e6578616d706c652f666565642e786d6c03746170706c69636174696f6e2f61746f6d2b786d6c046757726974696e67",
    "signatureHex": "4db146d7bc6ca7690bac44b0c6ef38bcdd685ff157fdcca15da6b64662a26f94bd95b88f97f3e720246b3756c6eb6b8967103f9346dbef51c053cac381a50204"
  },
  "expectedResult": {
    "valid": false
  }
}
