{
  "id": "verify-b8-attacker-target",
  "runnerProtocol": "1",
  "operation": "verifyRecord",
  "specificationCommit": "abc9a55d90f1026e6509207abda73e5dc6d14241",
  "specificationSections": [
    "Section 8.1 step 7",
    "Appendix B.7 item 1",
    "Appendix B.8"
  ],
  "derivationStatus": "specification",
  "faultProfile": "single",
  "expected": {
    "outcome": "rejected",
    "errorAssertion": "exact",
    "error": "identityBindingMismatch"
  },
  "input": {
    "targetDid": "did:flw:zQmPdjR6k8HFgbf4e51P7iMy4aY3buGsxQU49fSHdGhce7s",
    "envelopeHex": "d28443a10132a0590118a600010178376469643a666c773a7a516d5063477374426137775739686f59516253364a5a345578775a6d6f4b7237595666397937717869794433436d021b0000019fbd68f4fb030004a3000101a200320158202543b92ff1095511476adc8369db6ddc933665a11978dda1404ee1066ca9559d0258202a35f76c8bcc0c5fc69e99d51656c2a93a1c8e447677d6f78c8c9d729eef3ca607a4006d416c696365204578616d706c650166577269746572038176616363743a616c696365406578616d706c652e636f6d0481a500646665656401644665656402781e68747470733a2f2f616c6963652e6578616d706c652f666565642e786d6c03746170706c69636174696f6e2f61746f6d2b786d6c046757726974696e675840b8352e21b1168a4c74020f2b7cf10b519fda4fb0c2465a682328f802c08b1873e1b1c137b79cce7f81aa00fc1a5630e34c19500a016b45867c9900108625650e",
    "nowMs": "1785589200123"
  }
}
