{
  "id": "validate-cbor-nonminimal-length",
  "runnerProtocol": "1",
  "operation": "validateCbor",
  "specificationCommit": "abc9a55d90f1026e6509207abda73e5dc6d14241",
  "specificationSections": [
    "Section 6.1 rule 2"
  ],
  "derivationStatus": "specification",
  "faultProfile": "single",
  "expected": {
    "outcome": "rejected",
    "errorAssertion": "exact",
    "error": "nonDeterministicCbor"
  },
  "input": {
    "cborHex": "5800",
    "maxDepth": "8",
    "maxMembers": "256"
  }
}
